{"entry":"A","exits":["C"],"format":"nemoir.trace.workflow-graph/0.1","nodes":[{"capabilities":["fs.write"],"execution":"tool","id":"A","writes":[{"name":"note","optional":false,"type":"string"}]},{"capabilities":[],"execution":"model","id":"B","writes":[{"name":"score","optional":false,"type":"number"}]},{"capabilities":["http.fetch"],"execution":"tool","id":"C","writes":[{"name":"done","optional":false,"type":"bool"}]}],"policies":[{"kind":"deny","ref":"p-1","trigger_capability":"fs.write"}],"transitions":[{"from":"A","guard_kind":"always","priority":0,"to":"B"},{"from":"B","guard_kind":"always","priority":0,"to":"C"}],"workflow_id":"LoopTest"}